{
  "benchmark name": "ran",
  "program name": "ranzero",
  "function name": "snippet",
  "LOC":17,
  "# Loops":0,
  "# non-linear arithmetics":8,
  "changes": 
  [
    {
      "change line": 16,
      "change type": "Update", 
      "change operation": "Replace variable" 
    },
    {
      "change line": 20,
      "change type": "Delete", 
      "change operation": "Unused variable" 
    }
  ]
}