{
  "benchmark name": "ell",
  "program name": "plgndr",
  "function name": "snippet",
  "LOC":31,
  "# Loops":2,
  "# non-linear arithmetics":13,
  "changes": 
  [
    {
      "change line": 12,
      "change type": "Insert", 
      "change operation": "Extract variable"
    },
    {
      "change line": 18,
      "change type": "Update", 
      "change operation": "with Dummy value"
    },
    {
      "change line": 25,
      "change type": "Update", 
      "change operation": "Replace variable" 
    }
  ]
}