{
  "benchmark name": "ran",
  "program name": "poidev",
  "function name": "snippet",
  "LOC":39,
  "# Loops":3,
  "# non-linear arithmetics":13,
  "changes": 
  [
    {
      "change line": 16,
      "change type": "Insert", 
      "change operation": "Extract variable" 
    },
    {
      "change line": 18,
      "change type": "Delete", 
      "change operation": "Unused variable" 
    },
    {
      "change line": 42,
      "change type": "Update", 
      "change operation": "Replace variable" 
    }
  ]
}