{
  "benchmark name": "bess",
  "program name": "bessk",
  "function name": "snippet",
  "LOC":17,
  "# Loops":1,
  "# non-linear arithmetics":3,
  "changes": 
  [
    {
      "change line": 20,
      "change type": "Insert", 
      "change operation": "Split temporary variable" 
    },
    {
      "change line": 21,
      "change type": "Update", 
      "change operation": "Split temporary variable" 
    }
  ]
}