{
  "benchmark name": "CLEVER",
  "program name": "LoopMult2.main",
  "function name": "foo",
  "LOC":9,
  "# Loops":1,
  "# non-linear arithmetics":0,
  "changes": 
  [
    {
      "change line": 3,
      "change type": "Update", 
      "change operation": "Switch variable"
    },
    {
      "change line": 4,
      "change type": "Update", 
      "change operation": "Switch variable" 
    }
  ]
}