{
  "benchmark name": "bess",
  "program name": "bessk0",
  "function name": "snippet",
  "LOC":13,
  "# Loops":0,
  "# non-linear arithmetics":22,
  "changes": 
  [
    {
      "change line": 8,
      "change type": "Insert", 
      "change operation": "Extract Variable" 
    },
    {
      "change line": 8,
      "change type": "Update", 
      "change operation": "Replace Variable" 
    },
    {
      "change line": 13,
      "change type": "Update", 
      "change operation": "Replace Variable" 
    }
  ]
}