{
  "benchmark name": "bess",
  "program name": "bessi",
  "function name": "snippet",
  "LOC":38,
  "# Loops":1,
  "# non-linear arithmetics":19,
  "changes": 
  [
    {
      "change line": 22,
      "change type": "Update", 
      "change operation": "Initial value" 
    },
    {
      "change line": 23,
      "change type": "Insert", 
      "change operation": "Dummy statement"
    },
    {
      "change line": 31,
      "change type": "Update", 
      "change operation": "Replace variable with value" 
    }
  ]
}