{
  "benchmark name": "ran",
  "program name": "gasdev",
  "function name": "snippet",
  "LOC":25,
  "# Loops":1,
  "# non-linear arithmetics":10,
  "changes": 
  [
    {
      "change line": 9,
      "change type": "Insert", 
      "change operation": "Extract variable" 
    },
    {
      "change line": 23,
      "change type": "Delete", 
      "change operation": "Unused variable" 
    },
    {
      "change line": "25-26",
      "change type": "Insert", 
      "change operation": "Replace variable" 
    }
  ]
}